<?xml version="1.0" encoding ="iso-8859-1"?>
<?xml-stylesheet type="text/xsl" href= "TipoRuta.xsl"?>
<!DOCTYPE pagina SYSTEM "TipoRuta.dtd">
 
<pagina>
	<cabecera>
			<titulo>RUTAS DIFICULTAD MODERADA</titulo>
			<texto>Si se queire un poco de explicación, sino se puede borrar y dejar en blanco para un futuro.</texto>
	</cabecera>
	
	<cuerpo>
		<ruta>
			<nombre>RUTAS DE LAS ZORRILAS(GIBALBÍN)</nombre>
			<mapa>Imagen/Medio/Mapa/LasZorrillas.bmp</mapa>
			<texto1>cerca de Las Navas, Andalucía (España) </texto1>
			<imagen>Imagen/Medio/Desnivel/LasZorrilas.jpg</imagen>
			<grado>Moderado</grado>
			<distancia>30,42 km</distancia>
			<altitud_min>43 metros</altitud_min>
			<altitud_max>182 metros</altitud_max>
			<des_sub>371 metros</des_sub>
			<des_baj>381 metros</des_baj>
		</ruta>
		
		<ruta>
			<nombre>RUTAS POR MANCERA DE ABAJO</nombre>
			<mapa>Imagen/Medio/Mapa/Mancera.bmp</mapa>
			<texto1>cerca de Mancera de Abajo, Castilla y León (España) </texto1>
			<imagen>Imagen/Medio/Desnivel/Mancera.jpg</imagen>
			<grado>Moderado</grado>
			<distancia>61,82 km</distancia>
			<altitud_min>875 metros</altitud_min>
			<altitud_max>1.232 metros</altitud_max>
			<des_sub>649 metros</des_sub>
			<des_baj>664 metros</des_baj>
		</ruta>
	</cuerpo>
	
    <pie>
		<link1>Volver al Principio</link1>
		<link2>Inicio</link2>		
	</pie>
	
</pagina>
  